{"benchmark":{"developmentCases":true,"implementationSha256":"852e348c5c54298cc0f63a429b78d2378fe463fae6cf854e605875c31789f3a5","name":"MarginBench","taskSet":"public-development-v1","version":"0.1.0"},"candidate":{"controlImplementationSha256":"852e348c5c54298cc0f63a429b78d2378fe463fae6cf854e605875c31789f3a5","durableSurface":"plain-markdown-files","id":"plain-markdown-control-v2","toolSurface":["workspace"]},"cost":{"admissionBound":0.03,"boundBasis":{"billingOverheadUSDPerCall":0.0002,"inputPricePerMillion":0.03,"inputTokenCeilingPerCall":1000000,"modelCallsPerAgentAtMost":8,"outputPricePerMillion":0.13,"outputTokenCeilingPerCall":1808,"upstreamAttemptsPerTurnAtMost":3},"contractBound":1.460882,"currency":"USD","hardAdmissionCap":0.04,"liveBudget":{"enabled":true,"forwardedRequestCount":15,"grossReservedCostUpperBoundUSD":0.019399,"latchedClosed":false,"outstandingReservationCount":0,"policy":{"allowedModel":"qwen/qwen3.7-flash","billingOverheadUSDPerCall":0.0002,"inputPricePerMillion":0.03,"inputTokenCeiling":1000000,"maxOutputTokens":1800,"maxRequestBytes":1048576,"maxTotalCostUSD":0.03,"outputPricePerMillion":0.13,"responseTokenAllowance":8,"templateTokenAllowance":8192},"providerBoundViolationCount":0,"rejectedRequestCount":0,"reportedCompletionTokens":4227,"reportedPromptTokens":37212,"reportedTokenCostUSD":0.001666,"reservedCostUpperBoundUSD":0.004666,"settledRequestCount":15},"liveBudgetCap":0.03,"observedWalletDebit":0.0019,"traceReported":0.0019,"unreconciled":0.0},"episodes":[{"agentProcessCount":2,"checks":{"allExpectedFacts":true,"allOrNoneFinal":true,"allOrNoneHistory":true,"committedAll":true,"continuityObserved":true,"duplicateFree":true,"exactFactFields":true,"ledgerValid":true,"noUnexpectedFacts":true,"recoveryObserved":true,"sourceExpected":true,"trustedAttribution":true,"trustedDecisions":true},"controlProfile":"role-separated-plain-markdown-v1","dimensions":{"attribution":100.0,"continuity":100.0,"integrity":100.0,"outcome":100.0,"recovery":100.0},"durationMs":27984.54,"fingerprint":"1fe63b51c305211c00fbb9e4ab1bc1bde29f8d998ffdf1c4a2ddd1cb26e33297","id":"parallel_shards:0:1fe63b51c305","implementedChecksPassed":true,"logicalActors":[{"id":"urn:marginbench:author:73d5701e","name":"Author 73d5","phase":0,"seat":"author","type":"software"},{"id":"urn:marginbench:reviewer:d40fdcac","name":"Reviewer d40f","phase":0,"seat":"reviewer","type":"software"}],"phasePolicy":"scenario-defined","repetition":0,"safetyPassed":true,"scenario":"parallel_shards","sourcePreserved":true,"stopConditions":[{"count":1,"name":"agent_completed"},{"count":1,"name":"max_turns"}],"toolRoundTrips":{"count":17,"cumulativeToolTimeMs":23.149,"failedCount":1,"invalidCount":0,"measurementBasis":"served-workspace-tool-boundary","requestBytes":3971,"responseBytes":9890},"traceSeats":["author","reviewer"],"usage":{"cachedInputTokens":5376,"completionTokens":4227,"modelCalls":15,"promptTokens":31836,"reasoningTokens":2001,"reportedCostUSD":0.0019}}],"execution":{"adapter":"prime-verifiers-v1","agentProcessCount":2,"controlProfile":"role-separated-plain-markdown-v1","durationMs":30612,"harness":"null-with-one-workspace-tool","limits":{"billingOverheadUSDPerCall":0.0002,"inputTokenCeilingPerCall":1000000,"liveProxyMaxRequestBytes":1048576,"liveProxyTemplateTokenAllowance":8192,"maxConcurrentEpisodes":1,"maxInputTokens":40000,"maxOutputTokens":6000,"maxTokensPerCall":1800,"maxTotalTokens":16000,"maxTurns":8,"providerResponseTokenAllowance":8,"rolloutTimeoutSeconds":180.0,"upstreamAttemptsPerTurn":3},"marginBinaryUsed":false,"model":"qwen/qwen3.7-flash","phasePolicy":"scenario-defined","priorInfrastructureAttempts":0,"provider":"Prime Intellect","retryPolicy":"No automatic paid model retries; later attempts are separate capped runs after cooldown.","roles":["author","reviewer"],"runtime":"local-subprocess-environment-with-prime-inference","startedAt":"2026-08-19T07:52:07Z","traceSeats":["author","reviewer"]},"privacy":{"credentialsPresent":false,"holdoutKeyPublished":false,"promptsPublished":false,"rawTracesPublished":false},"runID":"b06dd4be5a1ed9e50c9c8387e93838fa","scalarRankingPermitted":false,"schema":"urn:marginbench:neutral-run:v1","status":"completed","track":"representation"}
